id,prefecture,city,title,category,amount,condition,desc,period,contact,applicationUrl,verified,lastChecked
1211,群馬県,前橋市,令和8年度家庭用ゼロカーボン推進補助事業（太陽光発電設備）,エコ,30000円/件,all,太陽光発電設備（1kW以上10kW未満）の新規設置に対する補助,2026-06-01〜2027-03-20,前橋市環境政策課 027-898-6210,https://www.city.maebashi.gunma.jp/soshiki/kankyo/kankyoseisaku/gyomu/1_2/23240.html,TRUE,2026-05-11
1212,群馬県,前橋市,令和8年度家庭用ゼロカーボン推進補助事業（蓄電池）,エコ,10000円/kWh（上限50000円）,all,再生可能エネルギーと接続するリチウムイオン蓄電池の設置補助,2026-06-01〜2027-03-20,前橋市環境政策課 027-898-6210,https://www.city.maebashi.gunma.jp/soshiki/kankyo/kankyoseisaku/gyomu/1_2/23240.html,TRUE,2026-05-11
1213,群馬県,前橋市,スズメバチ巣駆除費補助,生活支援,6100円/巣（生保全額）,all,市内の日常生活に支障をきたす場所にできたスズメバチの巣の駆除費用を一部補助,2026-04-01〜2026-12-28,前橋市環境保全課,https://www.city.maebashi.gunma.jp/soshiki/kenko/eiseikensa/gyomu/1/2/2843.html,TRUE,2026-05-11
1214,群馬県,前橋市,令和8年度不妊治療費助成事業,子育て,最大150000円（男性不妊加算50000円）,all,一般不妊治療・生殖補助医療の自己負担額の2分の1以内を助成（上限15万円）,〜2027-02-26,前橋市こども支援課 027-220-5704,https://www.city.maebashi.gunma.jp/soshiki/kodomomiraibu/kodomoshien/gyomu/4/5/1/3942.html,TRUE,2026-05-11
1215,群馬県,前橋市,生ごみ処理容器・電動式生ごみ処理機購入費助成,エコ,購入費の一部,all,家庭から出る生ごみの減量化を目的とした生ごみ処理機器の購入費補助,通年受付中,前橋市環境政策課,https://www.city.maebashi.gunma.jp/gyosei/2/5/2/index.html,TRUE,2026-05-11
1216,群馬県,高崎市,高崎市住環境改善助成事業,住まい,対象工事費の30%（上限200000円）,ownsHome,市内業者による居住住宅のリフォーム工事費を助成（前年合計所得400万円以下）,2026-07-01〜2026-11-30（事前申請）,高崎市建築住宅課,https://www.city.takasaki.gunma.jp/page/3352.html,TRUE,2026-05-11
1217,群馬県,高崎市,高崎市一般不妊治療費等助成事業,子育て,上限100000円（交通費別途）,all,タイミング法・人工授精など一般不妊治療費の自己負担額を助成,2026-04-01〜2027-02-26,高崎市子育て支援課,https://www.city.takasaki.gunma.jp/site/notice/60666.html,TRUE,2026-05-11
1218,群馬県,高崎市,高崎市中小企業等機械設備導入支援助成金,生活支援,年間上限5000000円（助成率2.1%）,all,リース契約による機械設備導入時のリース料の一部を助成し生産性向上を支援,2026-08-01〜2026-12-31（事前申請）,高崎市商工振興課,https://www.city.takasaki.gunma.jp/page/3420.html,TRUE,2026-05-11
1219,群馬県,高崎市,高崎市移住支援金,生活支援,単身600000円・世帯1000000円（子1人30万加算）,all,東京23区からの移住者に対する定住促進支援金,2026-04-01〜2027-02-05,高崎市企画調整課,https://www.city.takasaki.gunma.jp/page/3253.html,TRUE,2026-05-11
1220,群馬県,高崎市,高崎市中小企業経営安定化助成金,生活支援,事業所税相当額（黒字決算分）,all,市内中小企業者の経営安定と雇用確保を目的とした事業所税負担軽減助成,事業年度終了から3ヶ月以内,高崎市商工振興課,https://www.city.takasaki.gunma.jp/page/3419.html,TRUE,2026-05-11
1221,群馬県,太田市,住宅リフォーム支援事業補助金,住まい,工事費の30%（上限200000円・OTACO給付）,ownsHome,10年以上経過の市内住宅所有者が市内施工業者でリフォームする費用を補助,2026-04-21〜2027-01-29,太田市まちづくり推進課（市役所7階）,https://www.city.ota.gunma.jp/page/1148.html,TRUE,2026-05-11
1222,群馬県,太田市,住宅用太陽光発電システム導入報奨金,エコ,2kW以上7kW未満50000円・7kW以上70000円（OTACO）,ownsHome,令和8年度中に市内住宅へ太陽光発電システムを新規設置した方に報奨金を支給,2026-04-01〜2027-03-31,太田市脱炭素推進室（市役所5階）,https://www.city.ota.gunma.jp/page/1021934.html,TRUE,2026-05-11
1223,群馬県,太田市,定置用蓄電システム導入報奨金,エコ,容量4kWh以上50000円（OTACO）,ownsHome,太陽光発電と接続する環境共創イニシアチブ登録蓄電システムの設置に報奨金,2026-04-01〜2027-03-31,太田市脱炭素推進室（市役所5階）,https://www.city.ota.gunma.jp/page/1021934.html,TRUE,2026-05-11
1224,群馬県,太田市,第3子以降保育料免除事業,子育て,保育料全額免除（準認可は助成）,hasChildren,3人以上の子を養育する世帯の第3子以降の保育料を免除,毎年度申請（4月入園者は1月〜3月申請）,太田市こども課 0276-47-1943,https://www.city.ota.gunma.jp/005gyosei/0170-006kyoiku-kodomo/shiensaku.html,TRUE,2026-05-11
1225,群馬県,太田市,空家除却補助金,住まい,一部補助,ownsHome,市内の老朽空家の除却費用の一部を補助し、地域の安全・安心を確保,通年,太田市まちづくり推進課,https://www.city.ota.gunma.jp/life/sub/5/,TRUE,2026-05-11
1226,神奈川県,小田原市,再エネ・省エネ設備導入支援補助金（太陽光＋蓄電池）,エコ,7万円/kW（上限500万円）＋蓄電池は対象経費の1/3,ownsHome,太陽光発電システムと蓄電システムの同時設置に対し手厚く補助,2025年度分は2026年2月28日まで（令和8年度は調整中）,小田原市ゼロカーボン推進課 0465-33-1426,https://www.city.odawara.kanagawa.jp/field/envi/saiene/consideration/r4pv.html,TRUE,2026-05-11
1227,神奈川県,小田原市,小田原市不妊症治療費（先進医療分）助成事業,子育て,先進医療費の7/10（上限50000円/回）,all,保険適用の体外受精・顕微授精と併用した先進医療の自己負担分を助成,治療終了日から6ヶ月以内に申請,小田原市子育て政策課,https://www.city.odawara.kanagawa.jp/field/edu-ch/kosodate/advice/p26784.html,TRUE,2026-05-11
1228,神奈川県,小田原市,住宅設備改良助成（障がい者向け）,福祉,上限800000円（自己負担1/3）,all,障害者手帳1〜2級等を持つ方が居住住宅を改修する費用を助成（事前申請必須）,随時（改修前に申請）,小田原市障がい福祉課 0465-33-1468,https://www.city.odawara.kanagawa.jp/field/welfare/handic-s/medical/juutakusetubi.html,TRUE,2026-05-11
1229,神奈川県,小田原市,地域経済循環型住宅リフォーム支援事業,住まい,地場産品等30000円相当,ownsHome,市内施工業者で住宅リフォームを行った市民を対象に地場産品等を抽選で進呈,令和7年度実施（令和8年度は詳細調整中）,小田原市産業政策課,https://www.city.odawara.kanagawa.jp/field/industry/industrial_promotion/p39702.html,FALSE,2026-05-11
1230,神奈川県,小田原市,住居確保給付金（家賃補助）,生活支援,単身41000円・2人49000円・3〜5人53000円（月額上限）,all,離職等により困窮し住居喪失の危機にある方の家賃を最大9ヶ月補助,随時,小田原市福祉政策課 0465-33-1892,https://www.city.odawara.kanagawa.jp/field/welfare/self-support/p29378.html,TRUE,2026-05-11
1231,神奈川県,茅ヶ崎市,茅ヶ崎市不育症治療費助成事業,子育て,対象治療費の全額（上限100000円・通算2年度）,all,生殖医療専門医により不育症と診断された夫婦の治療・検査費用（保険外）を助成,治療終了から1年以内に申請,茅ヶ崎市保健所地域保健課 0467-38-3314,https://www.city.chigasaki.kanagawa.jp/kenko/1022964/1004042/1051172.html,TRUE,2026-05-11
1232,神奈川県,茅ヶ崎市,木造住宅耐震改修促進事業補助金（耐震診断）,安全,最大73000円（高齢者世帯99000円）補助,ownsHome,昭和56年5月以前建築の木造住宅の耐震診断費用を補助（1回のみ）,随時,茅ヶ崎市建築指導課,https://www.city.chigasaki.kanagawa.jp/machidukuri/shidou/1008193.html,TRUE,2026-05-11
1233,神奈川県,茅ヶ崎市,木造住宅耐震補強工事補助金,安全,工事費の1/2（上限500000円・高齢者世帯700000円）,ownsHome,市の耐震診断で評点1.0未満と判定された昭和56年以前木造住宅の耐震補強工事費補助,着工14日前までに申請,茅ヶ崎市建築指導課,https://www.city.chigasaki.kanagawa.jp/machidukuri/shidou/1008193.html,TRUE,2026-05-11
1234,神奈川県,茅ヶ崎市,住居確保給付金（家賃補助）,生活支援,単身41000円・2人49000円・3〜5人53000円（月額上限）,all,離職等で住居を失うおそれがある方の家賃を最大3ヶ月（延長あり）補助,随時,茅ヶ崎市生活福祉課,https://www.city.chigasaki.kanagawa.jp/fukushi_seikatu/1004481.html,TRUE,2026-05-11
1235,神奈川県,茅ヶ崎市,住宅設備改善助成（障がい者向け）,福祉,上限200000円（自己負担1割）,all,下肢・体幹・運動機能障害3級以上等を持つ方の住宅改修費（手すり・段差解消等）を助成,随時（事前申請必須）,茅ヶ崎市障がい福祉課,https://www.city.chigasaki.kanagawa.jp/shogai/1004360.html,TRUE,2026-05-11
1236,神奈川県,厚木市,定住促進子育て世帯住宅取得支援事業補助金,子育て,基本200000円（加算最大400000円）,hasChildren,50歳未満世帯主で中学生以下の子がいる世帯が市内住宅を取得した場合に補助,登記日翌日から6ヶ月以内に申請（令和8年4月1日開始）,厚木市住宅課 046-225-2330,https://www.city.atsugi.kanagawa.jp/soshiki/jutakuka/9/3/20447.html,TRUE,2026-05-11
1237,神奈川県,厚木市,親元近居・同居住宅取得等支援事業補助金,住まい,近居40万円・同居60万円（加算最大40万円）,ownsHome,市内に1年以上居住の親元に近居・同居するため市外から転入する子世帯の住宅取得を支援,登記日から6ヶ月以内,厚木市住宅課 046-225-2330,https://www.city.atsugi.kanagawa.jp/soshiki/jutakuka/9/3/4046.html,TRUE,2026-05-11
1238,神奈川県,厚木市,あつぎ暮らし応援事業補助金,生活支援,6000円（1人1回限り）,all,市内店舗で1万円以上の購入・支払いをした市民に現金6000円を補助（物価高騰対策）,令和8年1月21日〜（詳細は市告示による）,厚木市商業にぎわい課,https://www.city.atsugi.kanagawa.jp/soshiki/shogyonigiwaika/11/34471.html,TRUE,2026-05-11
1239,神奈川県,厚木市,物価高対応子育て応援手当,子育て,児童1人当たり20000円,hasChildren,物価高騰で生活が苦しい子育て世帯の児童に対し一人あたり2万円を給付,給付済み（詳細は市に確認）,厚木市子育て支援課,https://www.city.atsugi.kanagawa.jp/kosodate_kyoiku/teate_josei/index.html,TRUE,2026-05-11
1240,神奈川県,大和市,住宅用太陽光発電・蓄電池設置費補助金,エコ,太陽光10000円/kW（上限40000円）＋蓄電池上限30000円,ownsHome,FIT認定取得の市内住宅への太陽光発電システムと蓄電池の新規設置費用を補助,2026-04-01〜2027-02-15（先着順）,大和市環境農政部,https://www.city.yamato.lg.jp/gyosei/soshik/24/sumai/hojo_josei/11916.html,TRUE,2026-05-11
1241,神奈川県,大和市,自家消費型太陽光発電・蓄電池補助金,エコ,太陽光7万円/kW＋蓄電池は対象経費の1/3,ownsHome,発電電力の30%以上を自家消費する太陽光＋蓄電池同時設置（FIT非取得）への補助,2026-04-10〜2027-01-29（先着順）,大和市環境農政部,https://www.city.yamato.lg.jp/gyosei/soshik/24/sumai/hojo_josei/20402.html,TRUE,2026-05-11
1242,神奈川県,大和市,既存住宅断熱改修補助金,住まい,補助対象経費の1/3（戸建上限1200000円）,ownsHome,環境省認定製品を使用した窓・断熱材・玄関ドア等の断熱改修工事費の1/3を補助,2026-04-10〜2027-01-29（先着順）,大和市環境農政部,https://www.city.yamato.lg.jp/gyosei/soshik/24/sumai/hojo_josei/21788.html,TRUE,2026-05-11
1243,神奈川県,大和市,マンション耐震診断費補助金制度,安全,一部補助,ownsHome,昭和56年以前建築の分譲マンションの耐震診断費を補助,随時,大和市建築・開発指導課,https://www.city.yamato.lg.jp/gyosei/kurashi/sumai/hojo_josei/10752.html,TRUE,2026-05-11
1244,神奈川県,海老名市,環境保全対策支援事業補助金（太陽光・蓄電池）,エコ,太陽光20000円/kW（上限200000円）＋蓄電池上限70000円,ownsHome,市内住宅・事業所への太陽光発電・蓄電池等の新規設置費用を補助,2026-04-01〜2027-02-26（先着順）,海老名市環境課,https://www.city.ebina.kanagawa.jp/guide/kurashi/hozen/1016412.html,TRUE,2026-05-11
1245,神奈川県,海老名市,住宅取得支援事業補助金（子育て世帯型）,子育て,基本300000円（加算最大200000円・上限500000円）,hasChildren,50歳未満で18歳以下の子がいる世帯が中古住宅を取得した場合に補助,2026-04-15〜2027-02-26（先着順）,海老名市住宅政策課,https://www.city.ebina.kanagawa.jp/guide/sumai/jutaku/1013758.html,TRUE,2026-05-11
1246,神奈川県,海老名市,住宅改修支援事業補助金（多世代同居型）,住まい,最大300000円（工事費の1/5以内・工種別上限あり）,ownsHome,三世代以上同居または出産予定を含む世帯が市内住宅をリフォームする費用を補助,2026年内工事完了分（着工前申請）,海老名市住宅政策課,https://www.city.ebina.kanagawa.jp/guide/sumai/jutaku/1017814.html,TRUE,2026-05-11
1247,神奈川県,海老名市,住宅等防犯対策補助金,安全,購入・設置費の1/2（上限20000円）,ownsHome,防犯カメラ・センサーライト・防犯フィルム等の購入・設置費用の半額を補助（5000円以上が対象）,2026-04-01〜年度末（予算がなくなり次第終了）,海老名市危機管理課,https://www.city.ebina.kanagawa.jp/guide/kyukyu/bouhan/1007800.html,TRUE,2026-05-11
