id,prefecture,city,title,category,amount,condition,desc,period,contact,applicationUrl,verified,lastChecked
2211,滋賀県,大津市,大津市定住促進リフォーム補助金,住まい,工事費の20%・上限60万円（子あり世帯）,hasChildren,市外から転入し空き家等のリフォーム工事を行う世帯に補助。15歳未満の子または出産予定がある世帯は工事費の20%・上限60万円。,令和8年4月〜（予算の範囲内・先着順）,大津市 建築住宅課 077-528-2793,https://www.city.otsu.lg.jp/soshiki/035/1810/g/at/1522910180529.html,TRUE,2026-05-11
2212,滋賀県,大津市,出産・子育て応援給付金（妊婦支援給付金）,子育て,10万円（妊娠届出時5万円＋出生後5万円）,all,妊娠届出をした妊婦に5万円、出生後の子育て家庭に5万円を給付する国制度の大津市実施分。面談等の伴走型支援とセットで実施。,随時,大津市 子育て支援給付課 077-528-2543,https://www.city.otsu.lg.jp/soshiki/015/1406/o/67160.html,TRUE,2026-05-11
2213,滋賀県,大津市,物価高対応子育て応援手当,子育て,児童1人あたり2万円（1回限り）,hasChildren,令和7年9月分の児童手当受給者の0歳〜高校3年生年代の児童に一時金を支給。令和8年2月下旬から給付開始。,令和8年度,大津市 子育て支援給付課 077-528-2543,https://www.city.otsu.lg.jp/soshiki/001/1030/k/72666.html,TRUE,2026-05-11
2214,滋賀県,大津市,住民税非課税世帯エアコン購入費補助,生活支援,購入・設置費用の一部（上限あり）,all,令和8年1月1日時点で世帯全員が住民税非課税であり、居住住宅にエアコンが1台もない世帯に購入・設置費用を補助。熱中症対策・省エネ促進を目的とする。,令和8年度（詳細は市に要確認）,大津市 福祉政策課 077-528-2654,https://www.city.otsu.lg.jp/soshiki/020/1405/g/k/72937.html,TRUE,2026-05-11
2215,滋賀県,大津市,太陽光発電システム普及促進,エコ,滋賀県補助制度を案内（市独自補助は要確認）,ownsHome,大津市では太陽光発電設備の設置に関する情報を公式サイトで案内。滋賀県の省エネ・再エネ設備導入補助との連携情報も提供。,随時,大津市 環境政策課 077-528-2756,https://www.city.otsu.lg.jp/soshiki/030/1121/g/eco/1389139329296.html,TRUE,2026-05-11
2216,滋賀県,大津市,省エネ改修工事に伴う固定資産税減額,住まい,固定資産税1/3減額（1年間）,ownsHome,令和8年3月31日までに完了した省エネ改修工事が対象。自己負担60万円超の工事で窓断熱・床・天井・壁等が対象。太陽光設置も含む。,令和8年3月31日工事完了分まで,大津市 固定資産税課 077-528-2744,https://www.city.otsu.lg.jp/soshiki/005/1216/g/shisan/kaoku/1390353002604.html,TRUE,2026-05-11
2217,滋賀県,草津市,健幸エコハウス（太陽光発電・蓄電池）普及促進補助金,エコ,太陽光・蓄電池設置費の一部（滋賀県上乗せ補助含む）,ownsHome,草津市内の自己所有住宅に太陽光発電システムと蓄電池を設置する市民に補助金を交付。滋賀県の補助に上乗せする形で市独自補助を実施。,令和7年6月〜令和8年3月31日（令和8年度は要確認）,草津市 温暖化対策室 077-561-6581,https://www.city.kusatsu.shiga.jp/kurashi/kankyo/ondanka/ecohouse-hozyokin.html,TRUE,2026-05-11
2218,滋賀県,草津市,健幸エコハウス（遮熱カーテン）普及促進補助金,エコ,1世帯あたり2万円（上限）,all,遮熱機能付きカーテンの購入・設置費用を補助。エネルギー消費削減と物価高騰対応を目的とし、申請は購入後に行う。,令和7年6月〜令和8年3月31日（令和8年度は要確認）,草津市 温暖化対策室 077-561-6581,https://www.city.kusatsu.shiga.jp/kurashi/kankyo/ondanka/ecohouse-hozyokin.html,TRUE,2026-05-11
2219,滋賀県,草津市,省エネ・再エネ等設備導入加速化補助金,エコ,補助対象経費の1/3以内（再エネは指定施設で1/2以内）,all,省エネルギー設備・再生可能エネルギー設備の導入費用を補助。太陽光・蓄電池・断熱改修等が対象。令和7年度に実施。,令和7年度（令和8年度は要確認）,草津市 温暖化対策室 077-561-6581,https://www.city.kusatsu.shiga.jp/kurashi/kankyo/ondanka/hojokin-syoenesaiene.html,TRUE,2026-05-11
2220,滋賀県,草津市,妊娠・出産・育児に関する支援制度,子育て,妊婦5万円・出産後5万円（国制度の草津市実施分）,all,妊娠届出や出産後に伴走型相談支援を行い、経済的支援として給付金を交付。妊婦支援給付金・出産・子育て応援給付金を一括案内。,随時,草津市 健幸づくり政策課 077-561-2327,https://www.city.kusatsu.shiga.jp/kosodate/ninshinshussan/shienteate/index.html,TRUE,2026-05-11
2221,滋賀県,草津市,省エネ改修工事に係る固定資産税減額,住まい,固定資産税1/3減額（1年間）,ownsHome,昭和57年1月1日以前に建てられた住宅で省エネ改修工事を実施した場合、翌年度の固定資産税が1/3減額される。窓断熱等が主な対象。,令和8年3月31日工事完了分まで,草津市 固定資産税課 077-561-2375,https://www.city.kusatsu.shiga.jp/kurashi/zeikin/koteishisan/kaoku/shoenekaishu.html,TRUE,2026-05-11
2222,滋賀県,彦根市,住宅取得費補助金（移住者向け）,住まい,最大50万円（子育て世帯・若年世帯加算あり）,all,市外から彦根市へ移住し住宅を新築または購入した方に取得費用の一部を補助。令和7年度は予算上限に達し受付終了。令和8年度に要確認。,令和8年度（予算の範囲内・先着順）,彦根市 企画課 0749-22-1411,https://www.city.hikone.lg.jp/ijyu/shien/hojyokin/12998.html,TRUE,2026-05-11
2223,滋賀県,彦根市,子育て・若年世帯空き家リノベーション補助金,住まい,改修工事費の一部（上限あり）,hasChildren,彦根市空き家バンクを通じて空き家を取得した子育て・若年世帯が改修工事を行う場合に費用の一部を補助。空き家の有効活用と移住定住を促進。,随時（予算の範囲内）,彦根市 住宅課 0749-22-1411,https://www.city.hikone.lg.jp/kakuka/toshi_seisaku/4/2_2/2/11089.html,TRUE,2026-05-11
2224,滋賀県,彦根市,省エネ改修に伴う固定資産税減額制度,エコ,固定資産税1/3減額（1年間）,ownsHome,令和4年4月〜令和8年3月31日に既存住宅で省エネ改修（窓・床・天井・壁断熱、太陽光・高効率空調等）を実施した場合に税減額。,令和8年3月31日工事完了分まで,彦根市 税務課 0749-22-1411,https://www.city.hikone.lg.jp/kakuka/somubu/6/5/5/3963.html,TRUE,2026-05-11
2225,滋賀県,彦根市,新エネルギー・省エネルギー関連補助金（滋賀県経由）,エコ,各制度による（太陽光・蓄電池・省エネ機器等）,ownsHome,滋賀県が実施するスマートライフスタイル推進事業補助（太陽光・蓄電池・省エネ機器等）を案内。彦根市の補助金情報ページで一括掲載。,随時（令和8年度は要確認）,彦根市 環境課 0749-22-1411,https://www.city.hikone.lg.jp/kakuka/shimin_kankyo/5/2_2/chikyuonndannnka/27784.html,TRUE,2026-05-11
2226,滋賀県,彦根市,まちづくり推進事業総合補助金,生活支援,活動内容により異なる（上限あり）,all,彦根市内の自治会・町内会や市民活動団体が地域課題解決のために行う事業に補助。暮らしの安全・環境・福祉・文化等幅広い活動が対象。,随時（予算の範囲内）,彦根市 市民活動推進課 0749-22-1411,https://www.city.hikone.lg.jp/benri/teate/5/23684.html,TRUE,2026-05-11
2227,奈良県,奈良市,奈良市地域脱炭素移行・再エネ推進事業補助金（令和8年度）,エコ,太陽光7万円/kW（個人住宅・自家消費型）・蓄電池 対象経費の1/2（上限あり）,ownsHome,自己所有住宅に太陽光発電設備（自家消費率50%以上・FIT非認定）や蓄電池を設置する個人に補助（個人住宅向けは太陽光7万円/kW）。令和8年度実施中。FIT認定取得しないことが条件。,令和8年度（詳細は市に要確認）,奈良市 環境政策課 0742-34-4893,https://www.city.nara.lg.jp/site/zerocarbon/263838.html,TRUE,2026-06-10
2228,奈良県,奈良市,奈良市空き家・町家バンク活用住宅支援補助金,住まい,住宅購入・改修上限100万円・荷物撤去上限20万円,all,奈良市空き家バンクまたは奈良町町家バンク登録物件を活用する際の購入・改修・荷物撤去費用を補助。移住・定住促進と空き家解消を目的とする。,随時（予算の範囲内）,奈良市 住宅課 0742-34-4750,https://www.city.nara.lg.jp/naralovelive/reason/index.html,TRUE,2026-05-11
2229,奈良県,奈良市,奈良市物価高騰支援給付金（市民一律5000円）,生活支援,市民1人あたり5000円,all,奈良市民全員を対象に物価高騰への生活支援として一律5000円を給付。国の地方創生臨時交付金を活用。,令和7年度実施（令和8年度は要確認）,奈良市 給付金担当課 0742-34-4736,https://www.city.nara.lg.jp/soshiki/33/256396.html,TRUE,2026-05-11
2230,奈良県,奈良市,住居確保給付金（家賃補助）,生活支援,家賃相当額（上限あり・最長9ヶ月）,all,離職や収入減少等で住居を失うおそれのある方に、原則3ヶ月（最長9ヶ月）家賃相当額を給付し就労を支援する国制度の奈良市実施分。,随時（随時受付）,奈良市 福祉政策課 0742-34-4594,https://www.city.nara.lg.jp/soshiki/33/242970.html,TRUE,2026-05-11
2231,奈良県,奈良市,令和8年度建築関連補助事業（耐震・バリアフリー等）,住まい,各事業により異なる（上限あり）,ownsHome,木造住宅耐震診断・耐震改修・バリアフリー改修等の補助事業を令和8年度も実施。詳細は建築指導課で確認。,令和8年度（詳細は市に要確認）,奈良市 建築指導課 0742-34-4750,https://www.city.nara.lg.jp/soshiki/117/130644.html,TRUE,2026-05-11
2232,奈良県,橿原市,橿原市エコライフハウス推進事業（太陽光・蓄電池補助）,エコ,太陽光・蓄電池設置費の一部（令和7年度申請受付中）,ownsHome,市内の住宅に太陽光発電システムと定置用リチウムイオン蓄電池を設置する市民に補助金を交付。脱炭素社会の実現に向けた取組。,令和7年5月1日〜（令和8年度は要確認）,橿原市 環境保全課 0744-47-3530,https://www.city.kashihara.nara.jp/soshiki/1029/gyomu/2/6/1790.html,TRUE,2026-05-11
2233,奈良県,橿原市,既存木造住宅省エネルギー改修工事等補助事業,住まい,工事費の一部（上限あり）,ownsHome,既存木造住宅の省エネルギー化改修工事（断熱・窓改修・高効率設備導入等）に要する費用の一部を補助。市内業者施工が条件。,随時（予算の範囲内）,橿原市 住宅政策課 0744-47-3514,https://www.city.kashihara.nara.jp/soshiki/1009/gyomu/3/2/2192.html,TRUE,2026-05-11
2234,奈良県,橿原市,橿原市移住支援金,生活支援,単身60万円・世帯100万円（子1人につき100万円加算）,all,東京圏から橿原市へ移住し、指定求人への就業または起業支援金交付決定を受けた場合に支援金を支給。18歳未満同伴は子育て加算あり。,随時（申請要件を満たした日から3ヶ月以内）,橿原市 移住交流推進課 0744-47-3535,https://www.city.kashihara.nara.jp/soshiki/1027/gyomu/3204.html,TRUE,2026-05-11
2235,奈良県,橿原市,令和8年度物価高騰対応重点支援交付金,生活支援,対象世帯に給付（金額は交付金内容による）,all,国の物価高騰対応重点支援地方創生臨時交付金を活用し、橿原市が市民生活への支援を実施。令和8年度も継続実施。,令和8年度,橿原市 福祉政策課 0744-47-3524,https://www.city.kashihara.nara.jp/soshiki/1006/gyomu/9/5/19793.html,TRUE,2026-05-11
2236,奈良県,橿原市,経済的支援（子育て世帯向け各種給付）,子育て,各給付金・手当による,hasChildren,橿原市では子育て世帯向けに児童手当・医療費助成・ひとり親家庭支援等の各種経済的支援を一括して案内。詳細は公式サイトで確認。,随時,橿原市 子育て支援課 0744-47-3524,https://www.city.kashihara.nara.jp/soshiki/1036/gyomu/2/1/index.html,TRUE,2026-05-11
2237,奈良県,生駒市,創エネ・省エネシステム普及促進事業補助金,エコ,太陽光・蓄電池・高効率給湯機等の設置費の一部,ownsHome,2050年脱炭素社会の実現に向け、生駒市民が創エネ・省エネシステムを設置する費用の一部を補助。令和7年度の申請は令和7年5月〜令和8年3月31日。,令和7年5月〜令和8年3月31日（令和8年度は要確認）,生駒市 脱炭素まちづくり推進課 0743-74-1111,https://www.city.ikoma.lg.jp/0000021137.html,TRUE,2026-05-11
2238,奈良県,生駒市,住宅省エネルギー改修工事補助金,住まい,改修工事費の一部（補助率・上限は要綱による）,ownsHome,生駒市内の既存住宅所有者が環境負荷低減を目的とした省エネ改修工事を行う費用の一部を補助。断熱改修・高効率設備導入等が対象。,随時（予算の範囲内）,生駒市 建築課 0743-74-1111,https://www.city.ikoma.lg.jp/0000013060.html,TRUE,2026-05-11
2239,奈良県,生駒市,既存住宅耐震改修工事費補助,安全,改修工事費の一部（上限あり）,ownsHome,昭和56年5月31日以前建築の木造住宅に対し、現行耐震基準への改修工事費用の一部を補助。地震に対する安全性向上が目的。,随時（予算の範囲内）,生駒市 建築課 0743-74-1111,https://www.city.ikoma.lg.jp/0000003270.html,TRUE,2026-05-11
2240,奈良県,生駒市,既存住宅解体費用補助,住まい,解体費用の一部（上限あり）,ownsHome,生駒市内の老朽化した既存住宅の解体費用を補助し、安全な住環境整備と土地の有効活用を促進する。,随時（予算の範囲内）,生駒市 建築課 0743-74-1111,https://www.city.ikoma.lg.jp/0000009876.html,TRUE,2026-05-11
2241,奈良県,生駒市,ブロック塀等撤去工事費補助,安全,撤去費の1/2・上限15万円,all,道路等に面する高さ80cm以上で倒壊のおそれのあるブロック塀等を全撤去する工事費の1/2（上限15万円）を補助。地震時の人的被害防止が目的。,随時（予算の範囲内）,生駒市 建築課 0743-74-1111,https://www.city.ikoma.lg.jp/0000017481.html,TRUE,2026-05-11
2242,奈良県,生駒市,妊婦のための支援給付（妊婦支援給付金）,子育て,10万円（妊婦1人あたり）,all,妊娠届出をした妊婦に伴走型相談支援を行い、出産後の子育て安心につなげる経済的支援。出産・子育て応援給付金と合わせ最大10万円。,随時,生駒市 子育て相談課 0743-74-1111,https://www.city.ikoma.lg.jp/category/24-6-0-0-0-0-0-0-0-0.html,TRUE,2026-05-11
2243,和歌山県,和歌山市,和歌山市移住者空き家改修等補助金,住まい,改修工事費の一部（上限あり）,all,和歌山市へ移住した方が空き家を改修して居住する場合、改修工事等に要する費用の一部を補助。移住・定住促進と空き家解消の両立を図る。,随時（予算の範囲内）,和歌山市 耐震・空家対策課 073-435-1091,https://www.city.wakayama.wakayama.jp/kurashi/sumai_jyougesuidou/1001110/1010373/1049265.html,TRUE,2026-05-11
2244,和歌山県,和歌山市,和歌山市三世代ファミリー助成金,子育て,住宅取得・リフォーム費の一部（詳細は窓口で確認）,hasChildren,市外から転入した子世帯が親世帯と同居・近居するための住宅取得またはリフォーム費用を助成。中学生以下の子がいること等が条件。令和8年4月1日から申請受付開始。,令和8年4月1日〜（予算の範囲内）,和歌山市 子育て支援課 073-435-1329,https://www.city.wakayama.wakayama.jp/kurashi/kosodate/1001103/1012174.html,TRUE,2026-05-11
2245,和歌山県,和歌山市,和歌山市移住支援金,生活支援,単身60万円・世帯100万円（子1人につき100万円加算）,all,東京23区在住または通勤・通学者が和歌山市へ移住し就業・起業等の要件を満たした場合に支援金を支給。わかやま暮らし応援金と組み合わせ可能。,随時（移住後3ヶ月以内に申請）,和歌山市 移住・定住推進課 073-435-1048,https://www.city.wakayama.wakayama.jp/ijuteiju/1033815/1034426/1034248.html,TRUE,2026-05-11
2246,和歌山県,和歌山市,わかやま暮らし応援金,生活支援,単身10万円・世帯20万円（子育て世帯30万円）,all,東京圏以外を含む県外から和歌山市へ転入した方で移住支援金対象外の場合も対象。市独自の上乗せ応援金。条件は市公式サイトで確認。,随時,和歌山市 移住・定住推進課 073-435-1048,https://www.city.wakayama.wakayama.jp/ijuteiju/1033815/1034426/1056426.html,TRUE,2026-05-11
2247,和歌山県,和歌山市,住宅耐震改修費補助（建替え含む）,安全,補助率・上限は要綱による,ownsHome,昭和56年5月31日以前に建設された木造住宅の耐震改修または建替えに要する費用の一部を補助。地震に備えた安全な住まいづくりを支援。,令和8年度（詳細は市に要確認）,和歌山市 建築指導課 073-435-1091,https://www.city.wakayama.wakayama.jp/kurashi/sumai_jyougesuidou/1001110/1010372/1001903.html,TRUE,2026-05-11
2248,和歌山県,和歌山市,空き家を活用した地域交流拠点等づくり補助金,ユニーク,改修費の一部（上限あり）,all,空き家を10年以上、地域の交流拠点等として活用する場合の改修費の一部を補助。令和8年4〜5月に申請受付を実施。地域コミュニティの活性化が目的。,令和8年4月22日〜5月22日,和歌山市 耐震・空家対策課 073-435-1091,https://www.city.wakayama.wakayama.jp/kurashi/sumai_jyougesuidou/1001110/1010373/1020115.html,TRUE,2026-05-11
2249,和歌山県,田辺市,田辺市移住支援金,生活支援,単身60万円・世帯100万円（18歳未満1人につき100万円加算）,all,東京圏から田辺市へ移住しマッチングサイト掲載求人に就業または起業した方に支援金を支給。子ども1人につき100万円の加算制度あり。,令和7年4月〜令和8年2月27日（令和8年度は要確認）,田辺市 たなべ営業室 0739-33-7714,https://www.city.tanabe.lg.jp/tanabeeigyou/2019-0905-0956-75.html,TRUE,2026-05-11
2250,和歌山県,田辺市,和歌山県在宅育児支援事業給付金,子育て,月額15000円（最大150000円・10か月間）,hasChildren,多子世帯の第3子以降（または第2子で所得要件あり）の0歳児を在宅で育てる保護者に給付金を支給。生後2ヶ月超〜1歳になるまでの10ヶ月が対象。,随時,田辺市 子育て推進課 0739-26-4904,https://www.city.tanabe.lg.jp/kosodatesuishin/zaitakuikujishien.html,TRUE,2026-05-11
2251,和歌山県,田辺市,住居確保給付金（就労支援と家賃助成）,生活支援,家賃相当額（最長9ヶ月）,all,離職・廃業や収入減少で住居を失うおそれのある方に3〜9ヶ月間の家賃相当額を給付し就労・自立を支援する国制度の田辺市実施分。,随時,田辺市 社会福祉課 0739-22-5300,https://www.city.tanabe.lg.jp/fukushi/jukyokakuho,TRUE,2026-05-11
2252,和歌山県,田辺市,住宅耐震改修費補助（田辺市）,安全,補助率・上限は要綱による,ownsHome,昭和56年5月31日以前に建設された木造住宅の耐震診断・耐震改修工事費用の一部を補助。熊野地域の地震リスクに対応した安全な住まいづくりを支援。,随時（予算の範囲内）,田辺市 建築住宅課 0739-22-5300,https://www.city.tanabe.lg.jp/kenchiku/kenchiku/2018taisinjigyou.html,TRUE,2026-05-11
2253,和歌山県,田辺市,田辺市みんなでまちづくり補助金,ユニーク,活動内容により異なる（上限あり）,all,田辺市民が主体となって行う公益的なまちづくり活動の費用を補助。自主的・自立的な市民活動を支援し、地域課題の解決を図ることが目的。,随時（随時受付、2次募集あり）,田辺市 市民課 0739-22-5300,https://www.city.tanabe.lg.jp/jichi/shiminkatsudou/siminkatudou-hojyokin.html,TRUE,2026-05-11
2254,和歌山県,橋本市,転入夫婦新築住宅取得補助金,住まい,30万円（地域通貨5万円分含む）,all,橋本市外から転入した夫婦が市内に新築住宅を取得した場合に30万円（地域通貨5万円分含む）を補助。若年層の定住促進を目的とする。,令和8年度（予算の範囲内）,橋本市 産業振興課 0736-33-6234,https://www.city.hashimoto.lg.jp/guide/keizaisuisinbu/citysales/teijyu/hashimotogurasi/sintikuhojyo.html,TRUE,2026-05-11
2255,和歌山県,橋本市,空家等譲渡及び若者定住促進助成金,住まい,最大70万円（解体・除草・廃棄物撤去等の実費）,all,空き家の所有者が若年世帯に空き家を譲渡する際の解体・管理費用を補助し、若者の定住促進と空き家解消を図る。,随時（予算の範囲内）,橋本市 建築住宅課 0736-33-6051,https://www.city.hashimoto.lg.jp/guide/kensetsubu/kentikujutaku/jutakusisaku/akiya/jyoseiseido/akiyatoujyoutojyoseikin.html,TRUE,2026-05-11
2256,和歌山県,橋本市,空家等対策推進助成金,住まい,実費補助（上限あり）,all,橋本市内の空き家等の解体・改修等に要する費用の一部を助成し、老朽化空き家の解消と安全な住環境整備を推進。,随時（予算の範囲内）,橋本市 建築住宅課 0736-33-6051,https://www.city.hashimoto.lg.jp/guide/kensetsubu/kentikujutaku/jutakusisaku/akiya/jyoseiseido/akiyatoutaisakusuishinjyoseikin.html,TRUE,2026-05-11
2257,和歌山県,橋本市,省エネルギー化住宅改修補助（環境対策関連）,エコ,各国・県制度に応じた補助（DER蓄電池最大75万円等）,ownsHome,橋本市では国・県の省エネ住宅改修補助（みらいエコ住宅・蓄電池・V2H・HEMS・ZEH等）を案内。市公式サイトで最新制度を一括確認できる。,令和8年度（詳細は市に要確認）,橋本市 建築住宅課 0736-33-6051,https://www.city.hashimoto.lg.jp/guide/kensetsubu/kentikujutaku/jutakusisaku/reform/15124.html,TRUE,2026-05-11
2258,和歌山県,橋本市,子育て世帯向け各種助成（医療費・手当）,子育て,各給付による（医療費助成は通院・入院）,hasChildren,橋本市では子育て世帯を対象に、児童手当・子ども医療費助成・ひとり親家庭支援給付金等の各種経済的支援を一括して案内する。,随時,橋本市 子育て支援課 0736-33-6051,https://www.city.hashimoto.lg.jp/life_mokuteki/kosodate/josei/index.html,TRUE,2026-05-11
