id,prefecture,city,title,category,amount,condition,desc,period,contact,applicationUrl,verified,lastChecked
1911,宮城県,仙台市,太陽光発電等導入補助金（新築戸建住宅向け）,エコ,最大60万円,ownsHome,ZEH・ZEH水準の新築戸建住宅に太陽光パネルや蓄電池を導入する費用を補助。積載量・断熱性能に応じて30〜60万円,第1期:2026年5月1日〜12月15日／第2期:2026年12月16日〜2027年1月29日,カメイ株式会社内せんだいエコトク補助金事務局 TEL:022-393-7951,https://www.city.sendai.jp/ondanka/kodannetsu/sintikukodate.html,TRUE,2026-05-11
1912,宮城県,仙台市,せんだい健幸省エネ住宅補助金（部分改修向け）,エコ,窓最大10万円・床壁屋根最大30万円・LED最大5万円,ownsHome,住宅の断熱改修（窓・床・壁・屋根・天井）やLED照明交換工事費の一部を補助。予算総額4000万円,第1回:6月1〜10日／第2回:9月1〜10日／第3回:12月1〜10日（令和8年度）,カメイ株式会社内せんだいエコトク補助金事務局 TEL:022-393-7951,https://www.city.sendai.jp/ondanka/kodannetsu/kaisyuhozyo.html,TRUE,2026-05-11
1913,宮城県,仙台市,若年・子育て世帯住み替え支援事業,子育て,通常型25〜30万円・空き家活用型50〜65万円,hasChildren,39歳以下の若年世帯または小学6年生以下の子どもを持つ子育て世帯が仙台市内で住み替える際に助成,通常型第1回:2026年6月1日〜8月31日／第2回:2026年10月1日〜2027年1月8日,仙台市都市整備局住宅政策課 TEL:022-214-8330,https://www.city.sendai.jp/jutakutaisaku/kosodate/shien.html,TRUE,2026-05-11
1914,宮城県,仙台市,仙台市戸建木造住宅耐震改修工事補助金,安全,基本補助最大115万円（追加補助最大10万円）,ownsHome,昭和56年以前建築の木造住宅の耐震改修工事費を補助。対象工事費の5分の4（限度額115万円）,令和8年度受付中（予算終了まで）,各区街並み形成課または都市整備局建築指導課 TEL:022-214-8323,https://www.city.sendai.jp/kenchikubosai/kurashi/anzen/saigaitaisaku/jishintsunami/taisaku/kodate/koji/,TRUE,2026-05-11
1915,宮城県,仙台市,感震ブレーカー設置促進支援事業,安全,上限3300円（購入費補助）,all,地震火災リスクの高い住宅密集地の住民に感震ブレーカー購入費を補助。高齢者・障がい者・子育て世帯は取付作業も無償,令和7年9月30日〜令和8年1月9日（令和8年度は要確認）,仙台市感震ブレーカー受付窓口 TEL:0120-763-837,https://www.city.sendai.jp/gensaisuishin/kanshin.html,TRUE,2026-05-11
1916,宮城県,仙台市,国・県の省エネ等補助金情報（家庭向け窓口）,エコ,各補助事業による,ownsHome,先進的窓リノベ2026事業・ZEH補助金等の国・県補助金を市が取りまとめて案内。問い合わせは市環境局へ,随時（各事業による）,環境局脱炭素政策課 TEL:022-214-8682,https://www.city.sendai.jp/ondanka/kurashi/machi/kankyohozen/kurashi/hojokin/katei.html,TRUE,2026-05-11
1917,宮城県,石巻市,石巻市定住促進住宅取得等補助金,住まい,取得:最大170万円／改修:最大50万円,hasChildren,市外から石巻市に移住する子育て世帯（15歳以下の子または妊婦を含む）の住宅取得・改修費を補助,令和9年3月31日まで（建物引き渡し完了）,石巻市企画部SDGs移住定住推進課 TEL:0225-95-1111,https://www.city.ishinomaki.lg.jp/cont/10051050/igyuu/20210811161432.html,TRUE,2026-05-11
1918,宮城県,石巻市,石巻市結婚新生活支援事業補助金,生活支援,最大60万円（29歳以下夫婦）・通常30万円,all,令和8年1月1日〜令和9年3月31日に婚姻した39歳以下・所得500万円未満の世帯の新生活費用を補助,令和9年3月31日まで,石巻市企画部SDGs移住定住推進課 TEL:0225-95-1111,https://www.city.ishinomaki.lg.jp/cont/10051050/konkatsu/kekkonshinseikatu/20220408134646.html,TRUE,2026-05-11
1919,宮城県,石巻市,石巻市集会所建設費等補助金,生活支援,新築最大1400万円・改装修繕最大120万円（補助率1/2）,all,自治会・集会所管理団体が所有する集会施設の建設・改修・取得費用を補助,令和8年9月30日まで,市民生活部地域協働課 TEL:0225-95-1111,https://www.city.ishinomaki.lg.jp/cont/10153000/3635/000/syuukaijokennsetuhitouhojokinn.html,TRUE,2026-05-11
1920,宮城県,石巻市,みやぎ結婚支援センター登録料補助,生活支援,登録料の補助（金額は要確認）,all,宮城県の結婚支援センター（エンジュ）への登録費用を市が補助する制度,令和8年度受付中,石巻市企画部SDGs移住定住推進課 TEL:0225-95-1111,https://www.city.ishinomaki.lg.jp/cont/10051050/konkatsu/kekkonsienriyouhojo/20220408114746.html,TRUE,2026-05-11
1921,宮城県,石巻市,石巻市移住支援金制度,生活支援,世帯100万円・単身60万円（子1人追加100万円）,all,東京圏から石巻市へUIJターン移住し市内の対象法人に就職または起業した方に支援金を交付,令和8年度受付中（予算上限次第終了）,石巻市企画部SDGs移住定住推進課 TEL:0225-95-1111,https://www.city.ishinomaki.lg.jp/cont/10051050/igyuu/ijuushienkin/ijuushienkin.html,TRUE,2026-05-11
1922,宮城県,大崎市,エコ改善推進事業補助金,エコ,太陽光1kWあたり1万円(上限5万円)・蓄電池10万円・高効率給湯器1.5万円等,ownsHome,市内の世帯主または小規模企業者が自宅・事業所に太陽光・蓄電池・V2H・給湯器・生ごみ処理機を導入する費用を補助,令和7年7月31日まで（令和8年度は要確認）,環境保全課 TEL:0229-23-6074,https://www.city.osaki.miyagi.jp/shisei/soshikikarasagasu/shiminkyodousuishimbu/kankyohozenka/1/1/1671.html,TRUE,2026-05-11
1923,宮城県,大崎市,大崎市住宅新築移住支援事業,住まい,基礎額最大100万円＋加算最大40万円,ownsHome,大崎定住自立圏・隣接市以外に居住する40歳以下の夫婦が市内に新築住宅を建築・購入し定住する場合に補助,令和8年4月1日〜（予算終了まで）,大崎市建設部建築住宅課 TEL:0229-23-2108,https://www.city.osaki.miyagi.jp/shisei/soshikikarasagasu/kensetsubu/kenchikujuutakuka/2/1/1/3180.html,TRUE,2026-05-11
1924,宮城県,大崎市,物価高対応子育て応援手当,子育て,子ども1人につき3万円（1回限り）,hasChildren,令和7年9月分児童手当受給者および令和7年10月1日〜令和8年3月31日に出生した子の受給者に一時金を支給,令和8年3月10日〜令和8年6月10日（公務員のみ申請要）,子育て支援課 TEL:0229-23-6045,https://www.city.osaki.miyagi.jp/shisei/soshikikarasagasu/minseibu/kosodateshienka/3/3/21805.html,TRUE,2026-05-11
1925,宮城県,大崎市,大崎市地方生活実現移住助成金,生活支援,世帯移住の場合100万円・単身60万円（子加算あり）,all,東京圏から大崎市に移住し対象法人へ就業または起業した人に移住助成金を交付,令和8年度受付中,大崎市総務部政策課 TEL:0229-23-2111,https://www.city.osaki.miyagi.jp/shisei/soshikikarasagasu/shiminkyodousuishimbu/seisakuka/5/3592.html,TRUE,2026-05-11
1926,宮城県,大崎市,おおさきチャレンジ創業応援事業費補助金,生活支援,補助対象経費の一部（金額は要確認）,all,大崎市内で新たに創業する人を対象とした創業支援補助金,令和8年度受付中,産業経済部産業振興課 TEL:0229-23-2111,https://www.city.osaki.miyagi.jp/shisei/soshikikarasagasu/sangyokeizaibu/sangyoshokoka/6/5/1673.html,TRUE,2026-05-11
1927,宮城県,大崎市,大崎市骨髄バンクドナー助成事業,福祉,助成額は要確認,all,骨髄バンクへのドナー登録・提供を行う市民を支援する助成事業,令和8年度受付中,大崎市民政部 TEL:0229-23-2111,https://www.city.osaki.miyagi.jp/shisei/yokuriyosarerujoho/teate_josei/index.html,TRUE,2026-05-11
1928,北海道,札幌市,札幌市住宅エコリフォーム補助制度,エコ,改修費用の一部（詳細は事務局確認）,ownsHome,省エネ改修・バリアフリー改修を行う札幌市民に費用の一部を補助。令和8年度受付中,第1回:2026年5月22日〜8月28日／第2回:2026年9月4日〜11月27日,エコリフォーム事務局 TEL:011-206-1899,https://www.city.sapporo.jp/toshi/jutaku/03reform/eco/eco.html,TRUE,2026-05-11
1929,北海道,札幌市,再エネ省エネ機器導入補助金制度,エコ,太陽光1kWあたり2万円(上限13.9万円)・蓄電池1kWhあたり1.6万円・エネファーム8万円・地中熱ヒートポンプ20万円・ペレットストーブ5万円,all,市民が自宅に再エネ・省エネ機器を導入する費用を補助,第1回:2026年5月7日〜7月8日／第2回:2026年9月1日〜11月4日,再エネ省エネ機器導入補助金受付係 TEL:011-700-0699,https://www.city.sapporo.jp/kankyo/energy/hojo/kiki.html,TRUE,2026-05-11
1930,北海道,札幌市,札幌市木造住宅耐震改修工事等補助事業,安全,耐震改修最大140万円・段階改修1段階目最大80万円・2段階目最大60万円,ownsHome,昭和56年以前建築の木造住宅の耐震改修工事費を補助,2026年4月1日〜2026年9月11日,札幌市都市局建築安全推進課 TEL:011-211-2867,https://www.city.sapporo.jp/toshi/k-shido/taishin/mokuzou.html,TRUE,2026-05-11
1931,北海道,札幌市,札幌市地域防犯カメラ設置補助事業,安全,新規設置1台あたり最大18万円・撤去再取付1台あたり最大10万円,all,町内会・自治会・連合町内会が設置する防犯カメラの購入・設置費用を補助,2026年5月1日〜2026年9月30日,市民文化局地域振興部区政課 TEL:011-211-2252,https://www.city.sapporo.jp/shimin/chiiki-bohan/camerahojyo/hojyojigyo.html,TRUE,2026-05-11
1932,北海道,札幌市,就学援助制度,子育て,学用品費・給食費等（所得により算定）,hasChildren,経済的に就学が困難な小中学生の保護者に学用品費・給食費等を援助,令和8年度受付中,教育委員会教育推進課 TEL:011-211-3851,https://www.city.sapporo.jp/kyoiku/top/information/syugakuenjyo.html,TRUE,2026-05-11
1933,北海道,札幌市,障がい者交通費助成,福祉,交通費の一部（詳細は担当課確認）,all,障がい者の社会参加を促進するため交通費の一部を助成,令和8年度受付中,保健福祉局障がい福祉課 TEL:011-211-2936,https://www.city.sapporo.jp/shogaifukushi/kotsuhi/index.html,TRUE,2026-05-11
1934,北海道,旭川市,旭川市住宅改修補助金,住まい,省エネルギー型:工事費の1/10(上限10万円)・維持保全型:一律5万円,ownsHome,新築後15年以上経過した市内住宅の所有者が省エネ改修または維持保全工事を行う費用を補助,2026年5月11日〜2026年6月19日,旭川市建築部住宅課 TEL:0166-25-8510,https://www.city.asahikawa.hokkaido.jp/kurashi/401/ho01/ho001/d053154.html,TRUE,2026-05-11
1935,北海道,旭川市,令和8年度旭川市木質バイオマスストーブ導入促進事業補助金,エコ,薪ストーブ・ペレットストーブ各:対象経費の1/3(上限20万円),all,市民・市内事業者が薪ストーブまたはペレットストーブを導入する費用を補助。予算総額600万円,2026年4月17日〜2026年8月31日（必着）,旭川市環境部環境総務課 TEL:0166-25-5350,https://www.city.asahikawa.hokkaido.jp/kurashi/271/290/291/d069431.html,TRUE,2026-05-11
1936,北海道,旭川市,令和8年度旭川市地域エネルギー設備等導入促進事業補助金,エコ,対象経費の1/10・太陽光発電等上限10万円・ガスエンジンコージェネ上限5万円,all,市民・市内事業者が地中熱ヒートポンプ・太陽光発電・コージェネ等を導入する費用を補助,第1回:2026年4月17日〜2026年8月31日（必着）,旭川市環境部環境総務課 TEL:0166-25-5350,https://www.city.asahikawa.hokkaido.jp/kurashi/271/290/291/p005154.html,TRUE,2026-05-11
1937,北海道,旭川市,旭川市先進不妊治療費助成事業,子育て,対象費用の7/10(上限3.5万円)×最大6回・交通費も一部補助,all,保険診療と併用した先進医療を受けた43歳未満の妻を持つ法律婚・事実婚夫婦に治療費と交通費を助成,治療終了日から60日以内かつ令和9年3月31日まで,旭川市こども家庭センター TEL:0166-26-5500,https://www.city.asahikawa.hokkaido.jp/kurashi/218/228/230/p004682.html,TRUE,2026-05-11
1938,北海道,旭川市,子育て世帯生活応援給付金（旭川市独自）,子育て,児童1人につき1万円（1回限り）,hasChildren,令和7年9月30日時点で旭川市に住民登録があり対象年齢の児童を養育する世帯に市独自の給付金を支給,令和8年6月30日まで,旭川市こども・女性・若者未来部子育て助成課 TEL:0166-25-6446,https://www.city.asahikawa.hokkaido.jp/kurashi/218/228/230/d082970.html,TRUE,2026-05-11
1939,北海道,旭川市,高校生年代医療費無償化,子育て,医療費の窓口負担全額（公的保険適用後）,hasChildren,旭川市在住の高校生年代（2007年4月2日〜2010年4月1日生まれ）の医療費を無償化,令和7年8月1日〜（継続中）,旭川市こども・女性・若者未来部子育て助成課 TEL:0166-25-6446,https://www.city.asahikawa.hokkaido.jp/kurashi/218/228/230/d081321.html,TRUE,2026-05-11
1940,北海道,函館市,函館市特殊詐欺被害防止対策機器購入費補助金,安全,購入費の1/2(上限1万円),hasElderly,65歳以上の函館市民が特殊詐欺防止機器（自動通話録音機等）を購入する費用を補助。購入から90日以内または令和9年3月末までに申請,2026年4月1日〜（予算終了まで）,市民部くらし安心課防犯担当 TEL:0138-21-3169,https://www.city.hakodate.hokkaido.jp/docs/2023060200058/,TRUE,2026-05-11
1941,北海道,函館市,函館市移住支援金（UIJターン新規就業支援事業）,生活支援,世帯100万円(子1人追加100万円)・単身60万円,all,東京圏から函館市に転入し就業・起業・テレワーク等の条件を満たした方に移住支援金を交付,令和8年度受付中（転入後1年以内に申請）,函館市企画部移住・人口減担当 TEL:0138-21-3680,https://www.city.hakodate.hokkaido.jp/docs/2020043000070/,TRUE,2026-05-11
1942,北海道,函館市,函館市新エネルギーシステム導入補助金,エコ,太陽光発電・蓄電池・コージェネ各最大5万円,all,市内の個人・中小企業等が太陽光発電システム・蓄電池・ガスエンジンコージェネを自宅・事業所に導入する費用を補助,2026年4月1日〜2027年3月1日（先着順・予算終了まで）,函館市環境部環境政策課 TEL:0138-85-8197,https://www.city.hakodate.hokkaido.jp/docs/2020032700097/,TRUE,2026-05-11
1943,北海道,函館市,ヤングファミリー住まいりんぐ支援事業,子育て,月最大1.5万円（家賃の3万円超過分を補助）,hasChildren,市外から函館市内の指定対象地区へ転入した中学校卒業前の子を持つ世帯の家賃を最大2年間補助,毎年4月1日〜翌年3月1日随時受付（転入後2年以内）,函館市都市建設部住宅課 TEL:0138-21-3385,https://www.city.hakodate.hokkaido.jp/docs/2014020500059/,TRUE,2026-05-11
1944,北海道,函館市,函館市DX・生産性向上補助金,生活支援,生産性向上支援型:上限1000万円(1/2以内)・DX推進支援型:上限250万円(1/2以内),all,専門家派遣事業を受けた市内中小企業・個人事業主のDX推進・生産性向上に向けた設備・システム投資を補助,2026年4月20日〜2026年6月30日,経済部工業振興課 TEL:0138-21-3350,https://www.city.hakodate.hokkaido.jp/docs/2026042100025/,TRUE,2026-05-11
1945,北海道,函館市,函館市特産品開発支援事業補助金,ユニーク,対象経費の2/3以内(上限500万円),all,函館市内の食品関連中小企業等が新たな特産品を開発する費用を補助。財務健全性要件あり,2026年4月1日〜2026年4月15日（令和8年度受付終了）,経済部食産業振興課 TEL:0138-21-3310,https://www.city.hakodate.hokkaido.jp/docs/2026012600012/,TRUE,2026-05-11
